round,song1,q1,a1,song2,q2,a2,song3,q3,a3
Power Rangers,Go Green Ranger Go,"What is the name of Rita Repulsa's low level henchmen?","Putties.",Might Morphin Power Rangers,"What show was the power rangers footage from?","Super Sentai.","Breaking Bad Theme,"What famous actor voiced the evil monster Snizzard?,"Bryan Cranston."
Legend of Zelda,Ocarina,"The 5th game in the series released in 1998 relates to an obscure instrument. What is it?","Ocarina.",Legend of Zelda,"The Legend of Zelda, the first game of the series, was first released in Japan on February 21, 1986, on what game system?","Famicom disk system.",Everybody Wants to Rule the World,"What is the name of the game to be released in 2023?","Legend of Zelda: Tears of the Kingdom."
80s Cartoons,Dukes of Hazzard,"I'm going to list several cartoon shows. 4 are from the 80s. One I made up. Which one did I make up? Laverne & Shirley in the Army, The Dukes of Hazzard, Hulk Hogan's Rock and Wrestling, Gilligan's Planet, Police Academy. Or am I lying and they are all fake? Or are they all real?","All real.",Star Wars,"There were 2 Saturday morning Star wars cartoons in the 80s. Even Before Clone Wars. What were they? 2 points each.","Droids and Ewoks.",Jem Theme,"Name me an animated musical cartoon that ran from 1985 to 1988. The series was about record company owner Jerrica Benton, her singer alter-ego.","Jem and the Holograms."
Woodstock,Here comes the Sun,"What was the opening act at woodstock?","Richie Havens.",Get a Job,"Why was the show named after Charles M. Schultz creating the bird Woodstock? Snoopy's friend from the peanuts cartoons. It wasn't. Where did Woodstock take place? 3 point bonus what was it originally called?","It was supposed to take place in Woodstock but the town rejected them. It was held on Max Yasgur's dairy farm in Bethel, New York, 40 miles (65 km) southwest of the town of Woodstock. Billed as 'an Aquarian Exposition: 3 Days of Peace & Music'.",,"I know you can name me all 33 bands who played woodstock. Can you name 3 bands who were invited but declined or couldn't make it?","The Beatles, The Jeff Beck Group, Blues Image, The Byrds, Chicago, The Doors, Bob Dylan, Free, The Guess Who, Iron Butterfly, Tommy James and the Shondells, Jethro Tull, Led Zeplin, Lighthouse, Arthur Lee, Mind Garage, Joni Mitchell, The Moody Blues, Poco, Procol Harum, The Rascals, Raven, Roy Rogers, The Rolling Stones, Simon & Garfunkel, and Spirit. Strawberry Alarm Clack, Zager & Evans, and Frank Zappa declined."
Greek Mythology,No One is to Blame,"Who of the following is a Greek God, Demi-god, Hero or creature? Bacchus, Gilgamesh, Ganesha, or Urcaguary or none of those?","Bacchus.",Pandora's Box,"According to Hesiod, when Prometheus stole fire from heaven, Zeus, the king of the gods, took vengeance by presenting Pandora to Prometheus' brother Epimetheus. Pandora opened a jar left in her care containing sickness, death and many other unspecified evils which were then released into the world. Though she tried to close it quickly, only one thing was left behind. What was it?","Hope.",Magic Dance,"What did Daedalus construct for King Minos of Crete So that he could keep the Minotaur there?","Labyrinth."
Dallas Cowboys,Save a Horse,"According to Forbes Magazine the The Dallas Cowboys are the most valuable Football team in the world. What was their estimated Value in 2018?","5 Billion.",Dallas (Alan Jackson),"How many Super Bowls have the Cowboys been to?","8.",Theme from Dallas,"Name me the 3 current quarterbacks. 2 points each.","4 Dak Prescott, 15 Trey Lance, 10 Cooper Rush."
Neon Genesis Evangelion,American Idiot,"In the beginning of Episode one 'Angel Attack' as Shinji Ikari is running from the Angel… What color is his backpack?","Green.",Hit Me Up,"What kind of pet does Misato Katsuragi have? Bonus: What is its name?","A hot springs Penguin named Pen Pen. Your bonus is everlasting shame.",2525,"The show was released in 1995 and it was set in the future. In what year did the series take place?","2015."
Eyeballs,Conjunction Junction,"So you all know that The sclera is the tough protective outer shell of the eyeball, is composed of dense fibrous tissue that covers four-fifths of the eyeball. But what is the name of the transparent mucous membrane that covers the Sclera that prevents the eye from drying out?","The Conjunctiva.",Crawling in the Dark,"Give me the name of a 1958 horror movie about A series of decapitations on a Swiss mountainside that appear to be connected to a mysterious radioactive cloud.","The Crawling Eye.",Cyclops Rock,"In Greek Mythology there is a creature that only has one eye - what is it? The Cyclops, too easy. Originally, there were three of them and they were the sons of the titans Uranus and Gaea, what are their names? 2 points each, or give me three names and make me laugh, 1 point each.","Arges, Steropes, and Brontes."
80s Music,"The Future's So Bright, I Gotta Wear Shades","One hit wonders. Give me the title and artist of this song. 2 points each.","The Future's So Bright, I Gotta Wear Shades. Timbuk 3.",Edge of a Broken Heart,"One hit wonders. Give me the title and artist of this song. 2 points each.","Edge of a Broken Heart. Vixen.",I Always Fell like Somebody's Watching Me,"One hit wonders. Give me the title and artist of this song. 2 points each.","I Always Fell like Somebody's Watching Me. Rockwell. Michael Jackson on back-up vocals."
Evil Dead,I'm Still Standing,"What are the three words needed to deactivate the Necronomicon? According to Army of Darkness. Bonus: what famous Science fiction movie are they from?","Klaatu Barada Nikto. Day the Earth Stood Still.",Cabin in the Woods,"Where is this song from?","Evil Dead the Musical.",Captain Underpants / Love Will Keep us Together,"What was the name of the Army of Darkness in Japan? Bonus: Where does Ash work?","Captain Supermarket / S Mart."
Wives of Henry the Eighth,Everybody,"Henry the eighth had 6 wives. How many of them died?","All of them. That was almost 500 years ago.",Natalie,"In the Tudor mini series, what Game of Thrones actress played Anne Bolyn?","Natalie Dormer. Marjery Tyrell.",,"Henry had 2 of his wives, Anne Bolyn and Catherine Howard executed. How were they executed?","Beheading."