round,song1,q1,a1,song2,q2,a2,song3,q3,a3
LT ICP,Miracles,"What is the name of the scientific ICP song where they question how magnets work?","Miracles",All About the Boom,"What was the name of the ICPs pro Wrestling federation? It's the JCW but what does that stand for? Bonus what did it originally stand for?","Juggalo Championship Wrestling - Juggalo Chmpionshit Wrestling.",Root Beer,"What are their fans known as? Juggalos. At their shows The ICPsprays their fans with bottles of soda in a ritual now known as “Faygo showers.” what type of soda do they use? Its Faygo- but what flavor?","Only Faygo's root beer, as the other flavors can corrode most venues' electrical wiring."
Dark Souls,Don't Speak,"When you first meet Anastacia of Astora, she is suffering from what ailment?","Mute.",Ring My Bell,"What item do you get from Havel the Rock if you kill him?","Havel's Ring.",Maneater,"If you are in human form while near the bonfire in Blighttown, what NPC invades your world, wielding a butcher's kinfe?","Maneater Mildred"
Astronauts,Stonger,"Give me the name of an astronaut who shares his name with a stretchy toy from the 70s.","Neil Armstrong, Stretch Armstrong.",Son of a Sailor,"The word astronaut comes from the latin term Astron Nautes. WHat does that mean?","Star Sailor.",Star Trek,"What actor is going into space on blue origin October 12th?","William Shatner."
80s Music,The Reflex,"It would be hard to find a more 80s bands than Duran Duran. From what Bizarre 1968 Jane Fonda Science Fiction movie did they get their name from?","Barbella",Neverending Story,"The song Never Ending Story was performed by the immortal Limahl - but you all know that. What famous 80s band was he also the lead singer for?","Kajagoogoo",Walk Like an Egyption,"The bangles! They are very well known for their song Walk like an Egyptian. Name me another song they did.","Hero Takes a Fall, Going Down to Liverpool, Manic Monday, If She Knew What She Wants, Walking Down Your STreet, Following, Hazzy Shade of Winter, In Your Room, Eternal Flame, Be With You, I'll Set You Free, Everything I Wanted, Where Were You When I Needed You."
CERN Hadron Collider,Nuclear Family,"What does CERN stand for?","European Organization for Nuclear Research. The name CERN is derived from the acronym for the French Conseil Européen pour la Recherche Nucléaire.",She Blinded Me With Science,"Using the LHC (Large Hadron Collider) what amazing thing was discovered in 2012? It led to winning the Nobel Prize for Physics in 2013.","The Higgs Boson Particle.","Weird Science, Dear Future Husband","CERN unveiled plans for its next Collider in January 2019 - its more than 3 times as big as the LHC - what is it called?","Future Circular Collider(FCC)"
LT Airports,Delta Dawn,"What airline that currently has its main hub in Atlanta Started out as a crop dusting company?","Delta Air Company",MMMBop,"What is the airport code of Manchester NH?","MHT",Carry On My Wayward Son,"What is the airport code for Manhattan… Kansas?","MHK"
NSG Local 7 Ironworkers,Maniac,"The Iron Workers Local 7 are the best-trained workers specializing in bridge, structural, ornamental, reinforcing, pre-engineered metal buildings, industrial maintenance, architectural, heavy rigging, and WHAT else?","Welding",For the Love of Money,"In the leadership of the local 7 what position does William Hurley hold?","Financial Treasurer",Rock Lobster,"The local 7 has a motorcycle club. What animal is on the logo of the boston chapter?","Lobster"
Harry Chapin,"30,000 Pounds of Bananas","He was a big philanthropist and worked hard to end world hunger.  He helped create the  Presidential Commission on World Hunger in 1977.He was given an award by congress. What was it?","Congressional Gold Medal",Mama Said Knock you Out,"As you all know Harry Chapin is most well known for his work as a documentary film-maker. He received an academy award nomination in 1968. What was this documentary about","It was called legendary champions and it was about Boxing",Cats in the Cradles,"Harry Chapin Died in a car accident. What was he driving? What was the vehicle that hit him? What company owned the truck that hit him?","1975 Volkswagen, Flatbed tractor trailer - owned by Rickles Home Center of Paramus, N.J."
The Grinch,Torture Party in the CIA,"The makeup Jim Carey wore initially took 8 and ½ hours to put on. To deal with this an expert was brought in to help him cope. What was this person an expert in? Bonus - the suit was made of real animal hair. Where did the hair come from?","CIA torture endurance",Party All the Time,"Before Jim Carey there were 2 other choices for the Grinch - Jack Nicholson and who else?","Eddie Murphy",Grinch,"What is the Grinch's 1st line in the movie? Bonus - what is the 1st thing he eats?","'Well Done Max! Serves them right those yuletide loving, sickly sweet, nog sucking cheermongers! I really don't like em - mm-mm No I don't' - an onion"
Brewsiks,Beer Bottle Boogie,"A Labeorphilist Is A Collector of what? Lay beer OHR fee list","Beer bottles. Ron Werner currently holds the record for most unique beer bottles in a collection, with 25,866 individual types.",Crazy Train,"Teddy Bruschi - list me all the NFL teams Bruschi played for - 3 points each - 3 point bonus - whats his middle name?","The Patriots - Lacap",People are Strange,Name me the 1983 movie starring the characters Bob and Doug Mackenzie.","Strange Brew"
Queens Gambit,Queens Gambit,"The Netflix series is based on the 1983 novel by the same name, which was written by who?","Walter Tevis",Chess,"Where does orphan chess prodigy, Elizabeth Harmon, get her 1st lessons in chess? More detailed your answer is the more points you get - 2 point bonus - what is her teacher's name?","The basement of her orphanage - Mr Shaibel the custodian",Don't Stop me Now,"In the show she has several friends - 2 are played by actors in huge fantasy movie franchises","Harry (Harry Melling)  is Dudley Dursley in Harry potter And Benny (Thomas Brodie-Sangster) Was in the Maze Runner and was Jojen Reed in Game of Thrones"
Severance,Ben,"What comedian directed 6 of the 9 episodes?","Ben Stiller",I Go To Work,"What department do the shows Innies work for? The MDR not those psychopaths from the OaD.","Macro Data Refinement - Optics and Design.",Shakey Jake,"For her music dance experience reward, what music does Helly choose?","Defiant Jazz"
Universal Monsters,,"Released in 1923 what is considered the 1st Universal Horror movie- and who starred?","Hunchback of Notre Dame - Lon Chaney.",,"What comedy duo appeared in several universal horror movies?","Abbott and Costello",,"In 1987a movie from tri star pictures came out that paid homage to the universal films. It had Dracula, Frankenstein, the Wolf man and The creature from the black lagoon (kind of). What was it called? Bonus -it had a classic line about the wolf man. What does the wolf man have?","Monster Squad - Wolfmans got nards!!"
Periodic Table,Fly,"What is the heaviest of the naturally-occurring Noble Gasses?","Radon. Element 118 has been produced artificially and would fall under the Noble gas colum.",Beyond the Sea,"In the middle of the 20th century, the work of one man made major changes to the periodic table. He shared the discovery of plutonium and in addition discovered eight other elements. One element #106 is named for him and he shared the Nobel prize for Chemistry in 1951. What was his name?","Glenn T. Seaborg. McMillan, Kennedy, and Wahl shared the discovery of plutonium with Seaborg. Element 106, seaborgium bears his name.",Periodic Table Song,"Dmitri Mendeleev is often referred to as the Father of the Periodic Table. When did he publish his first periodic table?","1869"
70/80s Comedies,Leaving on a Jet Plane,"Give me the next line from this movie 'Surely you can't be serious.' 2 point bonus to name the movie.","I am serious...and don't call me Shirley.",Theme from Police Academy,"Which 80s movie spawned 6 sequels and  2 T.V. series?","Police Academy",House of the Rising Sun,"In what 1978 comedy did Kevin Bacon make his movie debut?","Animal House"
Legend of Zelda Ocarina of Time,Ocarina of Time,"Ocarinas, real ones, where did the originate? Weirdly, 2 different places. Bonus: how many holes do they have?","China and Mesoamerica (Aztecs and Mayans). 12 holes.",,"The control scheme introduced techniques such as context-sensitive actions and a targeting system which allows the player to have Link focus and latch onto enemies or other objects. What was this targeting system called?","Z-Targeting.",,"What is the name of the evil Gerudo king who is seeking the Triforce?","Ganondorf."
Rick and Morty,Danny Don't You Know,"Who created the animated sitcom show Rick and Monty? Bonus: one of the creators also made a pilot for a tv show starring Owen Wilson and Jack Black as the smartest man alive and a sentient motorcycle. What was that show?","Dan Harmon and Justin Roiland. Heat vision and Jack.",Jessie's Girl,"Justin Roiland voices 2 (actually several) characters on the show. Who are the 2 he voices in the 1st episode?","Rick and Morty (and Mr. Poopybutthole)",Pickle Rick,"What super leader was created by Rick by splicing DNA of two historical individuals? He 1st appeared in 'Close Rick-Counters of the Rick Kind'  the tenth episode of the first season.","Abradolf Lincler."
DnD 5.0,Greased Lightning,"We will start with a dragon question. Red dragons breath fire, White dragons breath frost. What breath weapon is used by the desert-dwelling blue dragon?","Lightning.",Do You Believe in Magic,"If I want to play as an intelligent spell caster who learned how to do magic through years of study. What class should I pick? A magician, a houdini, a sorcerer or a wizard?","Wizard.",8675309,"What type of die would you roll for long sword damage?","D8."
Elvis Presley,A Little Less Conversation,"What is Elvis' middle name?","Aaron.",Viva Las Vegas,"In the movie Viva Las Vegas, what is Elvis' profession?","Race car driver.",Yesterday/Hey Jude,"Elvis gained a small amount of success as a movie star and a singer, but his most well known as a master of karate. Name me any of his karate instructors.","Juergen Seydel,Tetsugio Murakami, Ed Parker, Hank Slomanski, Kang Rhee, Bill 'Superfoot' Wallace. Elvis was awarded 7th Degree Black Belt in 1973 by Master Rhee."
Harry Potter,Luna,"Name me the kind of spacey blond student wizard who is part of Dumbledore's army, unless your team name is Dumbledore's army, then give me her father's name.","Luna Lovegood, Xenophilius Lovegood.",Mud on the Tires,"What is the British term for a non magical person? Bonus: what is the derogatory term for a wizard without wizard parents?","Muggle / Mudblood.",Potter Music,"There is a new video game set in the Harry Potter world by Prot Key Games releasing this week. What is it?","Hogwarts Legacy."
Backstreet Boys,Bye Bye Bye,"What BSB was used in Magic Mike XL?","I want it that way.",Step by Step,"Which Backstreet Boy was in Edward ScissorHands?","Nick. Nick Carter of the Backstreet Boys plays an uncredited role as the blond boy playing on the Slip 'N Slide as Edward rides in Peg's car through suburbia.",Ebay,"When Nick and Brian are together, what are their corresponding nicknames?","Frick and Frack."
Friends,Poor Unfortunate Soul,"What is the name of Phoebe's twin sister? 2 point Bonus: on what other show did she appear? 2 point Bonus: Who appeared first?","Ursula. Mad About You. Ursula.",Dutches of Earl,"Which member of the British royal family appeared on Friends?","Sarah Ferguson / Duchess of York.",I'll be there for you,"Who says the last line in the series? It's one of the friends.","Chandler. Rachel says 'Should we get coffee?' Chandler says 'Sure! Where?'."
Caddyshack,Running up that Hill,"Give me the name of the name of the country club the movie takes place at.","Bushwood Country Club",West Side Story,"Who plays the assistant groundskeeper Carl Spackler? Bonus: what is the name of the head groundskeeper?","Bill Murray. Sandy McFiddish.",I Got You Babe,"At one point there is chaos in the pool? Why? Someone drops a candy bar in the pool and everyone thinks it's something else. What kind of candy bar?","Babe Ruth."
Helicopters,Hey Leonardo,"What famous inventor came up with a design for an early helicopter, or aerial Screw in the 1480s?","Leonardo Davinci.",I Can't Drive 55,"On  August 11th 1986 a Westland Lynx Helicopter set the world speed record for a helicopter. How fast did it go in miles per hour?","249.09 mph.",Airwolf Theme,"Give me the name of an 80s tv series starring Jan Michael Vincent about a supersonic helicopter used to fight bad guys.","Airwolf."
Jaws,Born to Run,"What was the name they gave the mechanical shark?","Bruce",Martha Speaks,"What is the name of the town in the movie? Bonus: where was the movie filmed?","Amity, Martha's Vineyard.",Louisiana Woman,"In part of the film they are trying to catch the shark and get a large shark. They cut it open to see if there are any human body parts. What weird item do they find? A license plate. What state is it from?","Louisiana."
Famous Captains,Rockabilly Kangaroo,"The host of a kids television series that aired weekday mornings on CBS for 29 years, from 1955 to 1984. His real name is Bob Keeshan and he also was a clown on another childrens show. 3 points for his captain character, 2 more for the name of the show he was a clown on.","Captain Kangaroo, Clarabell the Clown on Howdy Doody.",Mass Pike,"Name me the captain of the USS Enterprise from Star Trek, who was captain before Captain Kirk.","Captain Pike.",Love Boat Theme,"Give me the name of the Captain of the Pacific Princess, seen on the TV series that ran from 1977 to 1978.","Captain Merril Stubing."
Wizard of OZ,Toxic,"What was used to simulate snow in the poppy scene?","Asbestos. The snow wasn't the only asbestos-laden element of production: The Wicked Witch's broom was made of asbestos, as was the Scarecrow's entire outfit.",Dust in the Wind,"The Wizard of Oz was nominated for six Oscars in 1939, but lost Best Picture to what movie?","Gone with the Wind.",Ease on Down the Road,"In the 1978 movie the Wiz who played Dorothy and the Scarecrow?","Diana Ross and Michael Jackson."
80s Music,Take on Me,"In 1984 there was an amazing song and even more amazing video. It was called Take on Me. Who sang it? Too easy  -it was Ah- Ha. What European country are they from?","Norway.",Flashdance,"Which song from the movie of the same name won the 1980 Academy Award for Best Original Song?","Fame.",I'll be There for You,"Who was the 'Friend' Bruce Springsteen invited onto the stage to dance with him in the music video for 1984s 'Dancing in the Dark'?","Courtney Cox."
The Craft,Fight Song,"The film won an MTV Movie award. What was the award for?","Fairuza Balk and Robin Tunney won the MTV Movie Award for Best Fight.",Man I feel like a Woman,"Who do the witches in the movie worship?","Manon.",Sharknado,"What gift was washed up on the beach for Nancy?","Sharks."
Turkeys,Bad Blood,"What year did the official Presidential Turkey Pardoning take place?","1989. George Bush.",Duck and Run,"The wild turkey is one of only two birds native to North America that has been regularly domesticated. What is the second?","Mascovy Duck.",I'm in a Hurry,"Turkeys are the most hunted of all birds in North America. The wild turkey is the official game bird of 3 US states. What are they?","Alabama, Massachusetts, and South Carolina."
Schitt's Creek,Like a Surgeon,"Moira was a well known actress on the Soap Opera Sunrise bay. What was the name of her character. Too easy, Vivian Blake. What was her occupation?","Head of surgery.",Simply the Best,"The town of Schitt's Creek has its own a capella group. What is it called?","Jazzagals.",Mr. Jones,"When Moira Rose tries to make an acting comeback which movie does she star in?","The Crows Have Eyes III: The Crowening."
Ghostbusters,Ghostbusters,"In the first movie, where do they encountr the first ghost?","New York public library.",Walking on Sunshine,"Early in the movie Venkman is performing an ESP shock test. He makes sure the female test subject gets every answer right and zaps the male subject no matter what he says. He does get one answer right, and still gets zapped. What is on the card he guessed correctly?","Waves.",On our Own,"When asked if he has hobbies, what does Dr. Egon Spencer say?","'I collect spores, molds, and fungus.'"
Letterkenny,On Top of the World,"Letterkenny is about the small town of Letterkenny whose residents belong to one of three groups: Hicks, Skids and Hockey Players. The three groups are constantly feuding with each other over seemingly trivial matters. Where in Canada is Letterkenny located? What province?","Ontario.",You make my Dreams,"The show's leads are Wayne, Dary, Squirrely Dan and Katy. Dary is a nickname. What is Dary short for? A) Darnell B) Daryl C) Dartholemew D) Trick question. Dary is his actual name.","Daryl.",Crazy Little Thing Called Love,"One great thing in Letterkenny is the cold open alliterations they've had a few times. They take a subject and use  phrases about it  with words in only one letter. Then they go through the entire alphabet. One episode they do one about it cold. How many q words did they jam into the Q Phrase?","10-11. A quantity of quality quilts is quaint and quasi-quintessential to avoid quivering and quash quarreling if quarantined to one's quarters."
Letterkenny,,"The folks from Letterkenny have a secret weapon when dealing with the natives or the degens from up country. It's a dynamic duo known for ALLEGEDLY having relations with a most likely sick ostrich. Who is this duo?","The Ginger and Boots",,"Letterkenny is often Plagued by Degens from upcountry. Their French Canadian Counterparts also have upcountry Degens. Where are the French Canadian degens from?","Laval",,"In the show the leads spend a lot of their time drinking or being drunk. What alcohol are they mostly drinking? There are 2 specific types I'm looking for. A beer and a whiskey. 3 points for one. 7 points bonus for both.","Puppers and Gus n Bru."
70s Country Music,Take this Job and Shove it,"Who is singing this?","Johnny Paycheck.",Dukes of Hazzard Theme,"Who is singing this and what show is it from? 3 points each.","Waylon Jenings, Dukes of Hazzard",Thank God I'm a Country Boy,"Who is singing this?","John Denver."
Lock and Key,Man in the Mirror,"What Key does Bode find in the Garbage disposal?","The mirror key.",Anywhere for You,"What key does Bode find in his sister's bracelet? This key allows him to go anywhere.","The anywhere key.",Ice Cream,"Where is the 1st place Bode goes using the anywhere key?","The ice cream shop."
HH Holmes,Marry You,"Herman Webster Mudgett from Gilmanton, New Hampshire, later known as Dr. Henry Howard Holmes. He confessed to 27 murders, but only nine could be plausibly confirmed and several of the people he claimed to have murdered were still alive at the time of his confession. A 1940s pulp magazine claimed he killed as many as 200. He was also a bigamist. How many wives did he have at the same time?","3. Holmes married his first wife, Clara, in 1878; the couple had a son, but Holmes soon abandoned them and married Myrta Belknap in 1887. Finally, he married Georgiana Yoke on January 17, 1894, in Denver, Colorado, not long before he was arrested for insurance fraud. So technically, Holmes was still married to Clara, Myrta, and Georgiana when he was put to death in 1896.",Die Young,"Holmes had a minion and accomplice named Benjamin Pitezel. One of his insurance schemes was to have Pitzel fake his own death and collect the insurance. How did he help Pitezel fake his own death?","He didn't. He killed him. Chloroformed him and set him on fire.",Rawhide,"Aside from all the killing he was a wanted man for tons of insurance frau, but what was he finally arrested for?","He stole a horse in Texas."
Disney vs Desantos,Don't Say That,"The fight kind of started after Disney vocalized disapproval for Grand Moff Desantis Florida Parental Rights in Education Act. What is the more common name of this act?","Don't say gay bill.",Epcot Medley,"To punish Disney for daring to question his almighty authority, Ubermensch Desantis went after the Reedy Creek Improvement act. What is the reedy creek improvement act? To get the bill passed in 1968 disney promised to work on a planned city called EPCOT. What does EPCOT stand for?","It Declares Disney world as its own governmental County 'Experimental Prototype Community of Tomorrow'.",Kings and Queens,"Grand Wizard Desantis didn't want to dissolve the Reedy Creek Improvement act. He wanted to take control of it. How did the reedy creek board members block this.","They voted on a clause invoking King Charles III's last descendant in order to circumvent a rule against perpetuities to prevent the governor from using Disney's intellectual property."
NSG Old School Board Games,Get the Party Started,"Candyland is made up of colored spaces and you draw cards with colors telling you what space to go to, some spaces are specialty named spaces like the Gum Drop Mountains. What color are those spaces?","Pink.",Dashboard,"Name me a board game first published in 1963 that used a rube goldberg machine to drop a cage on players.","Mousetrap.",Cavity Search,"What is the name of the patient in the game operation?","Cavity Sam."
Dr. Who,Doctorin the Tardis,"TARDIS is a spacecraft and time machine in 'Doctor Who', what does it stand for?","Time and Relative Dimension in Space.",Dr. Who Theme,"Classic Who episodes are the ones that were made before the movie with Paul Mcgann. They ran from 1963 to 1989. How many episodes of 'Classic Who' were there?","694.",Mashed Potatoe,"Dr. Who has many iconic villains such as the Daleks, the Cybermen, the Siluruians and the Zygons. What alien menace does he face that are nicknamed 'Potato heads'?","Sontarans."
Coffee,Africa,"In what country did Coffee beans originate? It wasn't a country at the time, but what country is it now? As a 3 point bonus in what country was the 1st recorded instance of coffee being made as a drink?","Coffee originated from the continent of Africa in the country of Ethiopia. 1st made as a drink in Yemen in the 15th century.",Coffee is for Closers,"Here is a coffee movie question. In what movie does Alec Baldwin verbally abuse poor Jack Lemmon over a cup of coffee. From it we get the classic line 'Coffee is for Closers!!'","Glenngarry Glenrose.",Cotton Eye Joe,"How did the term 'Cup of Joe' originate?","It refers to a Navy Admiral Josephus 'Joe' Daniels who banned alcohol aboard Navy ships in 1914."
Pol Am MotoCross,Oops I Did it Again,"A motocross track consists of several jumps and obstacles. The mogul-like section of the track consisting of 10 or more tiny jumps in a row is called the what? Whoops, Rhythm, Washboard, or In field?","Whoops. Beginning riders take each mogul within a whoops section, but more advanced riders can just 'skip' over them, touching just the tops with their wheels. A rhythm section is similar to the whoops, but consists of several bigger jumps in a row.",Fly,"Which national rider, once known as the King of Supercross, is credited with inventing the trick called the 'nac-nac'? Brian Deegan,Travis Pastrana, Jeremy McGrath, or Ricky Charmichael?","Jeremy McGrath. On January 15, 1994, Jeremy McGrath was racing his 250cc Honda in Orlando, FL. On the last jump, while in midair, he swung his right leg over the rear fender and past the bike's left footpeg. It was so popular with the fans, other riders started doing similar tricks, leading to the new sport of Freestyle Motocross.",500 Miles,"Which outdoor motocross class was discontinued in the 1990s? MX lite, 250cc, 500cc, or 125cc?","500cc. In the early years of motocross, the 500cc class was considered the premier division. However, more riders preferred 250cc bikes as they were easier to handle. Over time, technology advanced and the 250cc's became faster and more powerful and eventually became the premier bike. In the 2000s, the 250cc and 125cc classes were discontinued and were renamed MX and MX Lite."
John Hughes Movies,Don't You Forget about Me,"Hughes paid tribute to his suburban upbringing by setting many of his movies in a little (fictional) town known as Shermer, Illinois. The breakfast club takes place there. Name me another that also does!","Planes, Trains & Automobiles, Weird Science, Ferris Bueller's Day Off, Sixteen Candles, Pretty in Pink, Uncle Buck, the Home Alone films, and the National Lampoon's Vacation films.",Breakfast Club,"He made a lot of High School Movies. Which John Hughes film was ranked No. 1 in Entertainment Weekly's list of the 50 Best High School Movies?","Breakfast Club. Ferris Bueller's Day Off did make the list as No. 10, but The Breakfast Club takes top billing as the No. 1 high school movie.",Candle in the Wind,"Though Hughes first made a name for himself with his screenwriting, he would become even better known for his directing. Which film was the first that he directed?","Sixteen Candles. His directing debut came in 1984 with the popular teen classic 'Sixteen Candles'. Hughes would go on to direct seven more films in the 1980s."
RuPaul's Drag Race,You Better Work,"How many versions of Rupaul's drag race have been made?","19.",Funkytown,"What is the Acronym LSFYL?","Lip Sync For Your Life.",Strong Enough,"What is the stage name of Drag Queen Chad Michaels? Shangela Laquifa Wadley, Jiggly Caliente, Ginger Minj or Chad Michaels?","Chad Michaels."
Labyrinth,Who are You,"What animal can Jareth the Goblin King turn into?","An owl.",Eye in the Sky,"What do the Fireys use for Dice?","Their eyes.",Magic Dance,"When Sarah meets Hoggle he is spraying Fairies. How many does he spray? Not on screen, that was three. In total.","60."
