letter,round,song,question,answer
B,Before and After,Dakota and the Dancing Bear,"State in which Mount Rushmore National Memorial is locate AND one of the Youngest actress to ever be nominated for a Screen Actor's Guild Award.","South Dakota Fanning."
B,Before and After,Our House,"The singer of Rehab and Back to Black AND the singers ofJump Around, Shamrocks & Shenanigans.","Amy Whinehouse Of Pain."
B,Before and After,Always Look,"Monty Python's 1979 mistaken Messiah movie AND Possibly South Park's favorite figure skater.","Monty Python's Life of Brian Boitano."
B,Before and After,Dance to the Music,"The singers of Everyday People and Hot Fun in the Summertime AND The singers of Vaseline and Interstate Love Song.","Sly and The Family Stone Temple Pilots"
B,Bears,Bear Necessities,"Surviving bear attacks. One type of bear you should play dead, one type you should try to scare it away. What type of bear should you play dead for? Brown, black or white?","'If it's brown, lay down. If it's black, fight back. If it's white, goodnight.'"
B,Bears,Bears,"Koala bears, not bears. What are they? What type of animal? Bonus: what is their closest relative?","Marsupials, The Wombat."
B,Bears,Black or White,"Polar bears used to be white but with global warming they are starting to turn yellow but that is their fur. What color is their skin?","Black."
B,Bears,Teddy Bears Picnic,"Name me a 2023 movie directed by Elizabeth Banks roughly based on a true story about a bear. Bonus: where does the movie take place? What state?","Cocaine bear, Chattahoochee-Oconee National Forest in Georgia."
B,Beets,Stuck in the Middle,"In what part of the world did the beet originate?","Middle East."
B,Beets,Island,"Name me a sitcom from the 60s where in one episode a character gained super speed from eating radioactive sugar beets.","Mrs. Howell, Gilligan's Island."
B,Beets,Borscht,"In Eastern Europe, what is beetroot soup called?","Borscht."
B,Beets,We got the Beet,The company hardbite makes vegetable chips with interesting  themed names like sweet spud of mine or 18 carat gold. What is the name of their musically themed beet chips?","Dropping mad beets chips."
B,Battlestar Galactica,Battlestar Theme,"The original series released in 1978 was sued by universal studios claiming it had stolen 34 distinct ideas from what movie?","Star Wars."
B,Battlestar Galactica,Shining Star,"Name me the character from the original series that was genderswapped in the 2004 series. Bonus: name me the actors that played them.","StarBuck. Dirk Benedict, Katee Sackhoff."
B,Battlestar Galactica,Call Me,"Name me the 1980s spinoff where the Galactica returned to earth and they had flying motorcycles. Here is a top song from the year it came out.","Galactica 80."
B,Battlestar Galactica,,"What is the affirmation or cheer they use in the 2004 Galactica show? It's kind of like amen or oorah in the marines.","So say we all."
B,Beer,Pump Up the Volume,"What does 'ABV' mean?","Alcohol By Volume."
B,Beer,At The Top,"'Goldings' is a variety of what?","Hops."
B,Beer,Good Thing,"What ber has used the slogan 'Good things come to those who wait'?","Guinness."
B,Beer,The Night Chicago Died,"Around 1750 BC, according to the Babylonian Code of Hammurabi what was the penalty for watering down beer?","Death."
B,Board Games,Atlantic City,"The original version of Monopoly was based on the streets of what city?","Atlantic City."
B,Board Games,Settlers of Catan,"What game designed in the nineties by Klaus Teuber does the game board represent an island cmposed of hexagonal tiles on which players build settlements, cities, and roads?","Settlers of Catan."
B,Board Games,Trivia Night,"Which game was created by Canadians Chris Haney and Scott Abbott? If you are here you're probably familiar with this game.","Trivial Pursuit."
B,Board Games,Sandcastles in the Sand,"Name the only move in chess in which a player moves two pieces in the same move.","Castling."
B,Barbarians,Thunderstuck,"Give me the name of a cartoon barbarian from a 1980s cartoon. He had a sun sword and hung out with his good buddy Ookla the Mok.","Thundarr the Barbarian."
B,Barbarians,Barbarian Music,"Ronert E Howard wrote about one of the most famous finctional barbarians, but he also wrote about another. There was even a movie about him that starred Kevin Borbo. Who was he?","Kull the Conqueror."
B,Barbarians,Hungry Like the Wolf,"What historical barbarian horde led by Atilla invaded Rome from the west?","The Huns."
B,Barbarians,The Warrior,"In the 1984 movie Conan the Destroyer staring Arnold Schwarzenegger, what famous basketball star played the character Bombaata?","Wilt Chamberlain."
B,Bacon,Bacon Song,"We do know that bacon most often comes from pigs, but where on the pig would you find the bacon bits?","Pork bell, side belly, back fat."
B,Bacon,You Dropped a Bomb on Me,"During WWII, the US government urged citizens to donate their excess bacon fat to the army. What was that bacon fat used for?","Making bombs. Actually glycerin that was used in bombs."
B,Bacon,Tricky,"Though delicious, bacon may also be dangerous (aside from the cholesterol thing). If untreated, it may contain a parasitic roundworm that could cause what disease?","Trichinosis."
B,Bacon,American Made,"The avergage American eats how much bacon each year? 1 pound, 5 pounds, 15 pounds, or 50 pounds?","15 pounds."
B,Bugs,The Bug,"In the animal world, scientifically, what is considered a bug?","A bug is an insect in the group Hemiptera. It must have piercing mouthparts. Cicadas, aphids, planthoppers, leafhoppers, assassin bugs, bed bugs. Ladybugs are beetles."
B,Bugs,Science,"What is the study of insects called?","Entomology."
B,Bugs,Bugs - Code Monkey,"Why are computer bugs called bugs?","In 1946, an error was caused in the electromechanical computer MARK 2 by a moth being trapped in it."
B,Bugs,Bugaboo,"Name me the company that produces high end baby strollers. Their name also oddly enough means an object of fear or alarm.","Bugaboo."
B,Bats,Bat Out Of Hell,"There is a vast array of bats, 1400 species. The smallest, the BumbleBee Bat weighs about as much as a penny. One of the largest is the flying fox. What is its wingspan?","6 feet."
B,Bats,Gunpowder and Lead,"Bat Guano was heavily harvested during the 1800s. What was it used for? It was fertilizer but also something else. What else?","Gunpowder production, Potassium Nitrate, Slatpetre."
B,Bats,Your Love,"In May of 2022 a baseball bat sold at auction for 1.08 billion dollars. Whose bat was it?","It was used by Jackie Robinson in the 1949 All-Star game."
B,Bats,Let's Hear it for the Boy,"Give me the name of a fictional character who first appeared in the Tabloid Weekly World News in 1992. In 1997 a musical was made about him.","Batboy."
B,Bikes,Ordinary World,"What are those old timey bikes from the 1800s with a giant wheel in the front called?","A penny farthing, high wheeler and ordinary."
B,Bikes,Bouncing Off the Walls,"You know a bike with one wheel in front  and 2 in back is a tricycle. What is a motorcycle with 2 wheels in front and one in the back? Apparently a lot of things. what is the one made by the company Can Am Called?","Spyder."
B,Bikes,Proud Mary,"Give me the name of the low-riding tricycles, made mostly of plastic, with a larger front wheel. Introduced by Louis Marx and Company in 1969.","Big Wheel."
B,Bikes,Bicycle,"What bike race did Lance Armstrong win? The tour de France, and he was banned and all his results were erased. How many did he win before he was banned?","7."
B,Brains,Insane in the Brain,"According to the movie The Water Boy, what is Adam Sandler's least favorite part o the brain?","Medulla Oblongata."
B,Brains,Brain Stew,"How much of the brain do we use?","The 10% thing is a mything. Over the course of a day we use 100%, just not all at once."
B,Brains,Billie Jean,"Who is the Brain in the Animaniacs cartoon? Mouse trying to take over the world. What was the girl he had a crush on that looked like Pinky?","Billie."
B,Brains,Brain,"Sperm whales have the largest brains of any animal. How big are they? How much do they weigh?","18 pounds. 45 tons (40 metric tons), giving it a brain-to-body-mass ratio of 1:5,100. Humans are about 1:40. There is a type of ant that is about 1:8. They'll be taking over the world soon."
C,Cults,Cult of Personality,Name me the band that sings cult of personality. Bonus: What pro wrestler uses this as his entrance music?","Living Colour. CM Punk."
C,Cults,Blinded me with Science,"What cult was created by L. Ron Hubbard? The cult has many famous members. Name me the celebrity who escaped and now does documentaries about the crazy.","Scientology. Leah Remi."
C,Cults,Wacko from Waco,"Waco, Texas 1993. Branch Davidians. The ATF tried to arrest them and 4 officers and 6 Davidias were shot and killed. 51 days later the compound caught fire and more people died. How many?","79. All though 20 were shot to death and one 3 year old was stabbed."
C,Cults,Startrek,"Heaven's Gate cult. Committed mass suicide to be taken away on a spaceship driven by Jesus that was behind the hale-bopp comet. They were all found wearing the same thing. What did they have on?","Identical black shirts and sweatpants, brand new black-and-white Nike Decades athletic shoes, armband patches reading 'Heaven's Gate Away Team' (one of many instances of the group's use of the nomenclature of the fictional universe of Star Trek).[citation needed] Each member carried a five-dollar bill and three quarters in their pockets.[42]"
C,Codes,Got What I Need,"Give me the name of a very inaccurate world War 2 movie from 2000 about the capture of an Enigma device to crack the German Enigma code.","U571."
C,Codes,Contra,"What is the contra or Konami  code?","up, up, down, down, left, right, left, right, B, A and Start."
C,Codes,Somebody Told Me,"What serial killer from northern california in the 60s used codes in his letters to the police?","Zodiak Killer."
C,Codes,Superman,"In 1990, the CIA teased its own analysts by installing a sculpture with a complex four-part code on the grounds of its Langley headquarters. To date, only three of the four parts have been solved.what is the name of this code?","Kryptos"
C,C Movies,Mr Cellophane,"Name me these musicals. Bactrian Place for Used Cars, Windy City, Why Taylor, Why?","Camelot, Chicago, Cats."
C,C Movies,Cannibal,"Give me the name of a very early found footage horror movie from 1980. Some of the scenes were so believable that the director was accused of making a snuff film and arrested for murder. Bonus: name me 2013 movie by Eli Roth that was an homage to this movie.","Cannibal Holocaust. Green Inferno."
C,C Movies,I'm Alright.,"Name me these comedy movies. Wire man - 1996, Our northern neighbors 8 degrees person - 1994, The poor take on the rich in a sporting event with explosions - 1980.","Cable Guy, Canadian Bacon, Caddyshack."
C,C Movies,Chariots of Fire,"Name me these drama, action and thriller movies. Scary Cloak -1991, Malcom Mcdowell's other x-rated film - 1979, Vurning horse drawn cart - 1981.","Cape Fear, Caligula, Chariots of Fire."
C,Comic Strips,I Ran,"Name me a strip known for its single panel jokes and anthropomorphic animals. Bonus: name me the creator","The Far Side, Gary Larson."
C,Comic Strips,Horrible Kids,"Name me a comic strip about a viking that was 1st published in 1973","Hagar the Horrible."
C,Comic Strips,Dilbert' Ditty,"Name me a workplace comic strip. Recently many papers stopped carrying this strip due to the creator being what?","Dilbert. Racist."
C,Comic Strips,Coward of the County,"Name me 4 Comic strips with cats. 2 have orange striped cats. One is a stuffed cat. And the last has a cat named Bill.","Garfield, Heathcliff, Bloom County, Calvin and Hobbes."
C,Camps,Short Skirt Long Jacket,"I’m going to give you the name of a fictional camp and I want you to tell me what movie, tv show or book its from. So if I say camp Crystal Lake, you’d say friday the 13th. Camp Anawanna.","Salute Your Shorts."
C,Camps,Paradise by the Dashboard Lights,"I’m going to give you the name of a fictional camp and I want you to tell me what movie, tv show or book its from. So if I say camp Crystal Lake, you’d say friday the 13th. Camp North Star.","Meatballs."
C,Camps,Einsamer,"I’m going to give you the name of a fictional camp and I want you to tell me what movie, tv show or book its from. So if I say camp Crystal Lake, you’d say friday the 13th. Tall Oaks Band Camp.","American Pie."
C,Camps,Adams Family Groove,"I’m going to give you the name of a fictional camp and I want you to tell me what movie, tv show or book its from. So if I say camp Crystal Lake, you’d say friday the 13th. Camp Chippewa.","Adams Family Values."
C,Country Singers,Jolene,"Which country music star wrote and first recorded 'I Will Always Love You', a song which later became one of the biggest selling singles of all-time for Whitney Houston?","Dolly Parton."
C,Country Singers,I Want my Mullet Back,"Who is the very famous daughter of the singer of this song?","Miley Cyrus"
C,Country Singers,Dixieland Delight,"'There’s Your Trouble', 'Cowboy Take Me Awa', and 'Landslid' were hit records for which country music group?","Dixie Chicks."
C,Country Singers,Hee Haw,"Give me the name of a TV show that featured Country music and comedy skits that started its run in 1969. It was hosted by country music artists Buck Owens and Roy Clark.","Hee Haw."
C,Centuries,Time in a Bottle,"What century did these events take place in? Division of Charlemagne's Empire between his grandsons with the Treaty of Verdun. This sets the stage for the founding of the Holy Roman Empire and France as separate states. Viking Great Army arrives in England. Earliest known printed book in China with a date. Alfred the Great assumes the throne, the first king of a united England.","800s AD."
C,Centuries,Time After Time,"What century did these events take place in?Expulsion of the last King of Rome, founding of the Roman Republic (traditional date). Confucius, founder of Confucianism, is born. Democracy instituted at Athens. Siddhartha Gautama (Buddha), founder of Buddhism is born as a prince of the Shakya tribe.","500s BC."
C,Centuries,Time of the Season,"What century did these events take place in? William Wallace is executed for treason. The Hundred Years' War begins. England and France struggle for a dominating position in Europe and their region. The Black Death ravages Europe for the first of many times. An estimated 20% – 40% of the population is thought to have perished within the first year. The Bible is translated into English by John Wycliffe.","1300s"
C,Centuries,Jungle Love,"hat century did these events take place in? Tokugawa Ieyasu takes the title of shōgun, establishing the Tokugawa shogunate. Jamestown, Virginia, is settled as what would become the first permanent English colony in North America. Mount Vesuvius erupts. Salem witch trials in Massachusetts.","1600s."
C,Cities,Take my Breath Aaway / Looking for Freedom,"This city sits on the banks of the river Spree and is currently the most populous city of the European Union. It is home to world-renowned Humboldt University.","Berlin."
C,Cities,One Night in Bangkok,"This city is the capital and most populous city of Thailand. It is known in Thai as Krung Thep Maha Nakhon. It is known for some famous Buddhist temples including Wat Arun and Wat Pho.","Bangkok."
C,Cities,More than a Feeling,"Give me the name of a city founded on the Shawmut Peninsula in 1630 by Puritan settlers. It had many firsts including the first public park and the first public school.","Boston"
C,Cities,Olympic Fanfare,"This city is the 'billionaire capital of the world' with the highest number of billionaires living in the city. It has a population of 21 million people and in 2022 it became the first city to ever host the Summer and Winter Olympics.","Beijing."
C,Crows,You Give Love a Bad Name,"The crow. A great movie from 1994. What tragedy happened during the filming of this movie.","Brandon Lee was shot and killed."
C,Crows,Murder on the Dance Floor,"Dogs are a pack, Whales are a pod, Owls are a parliament. What is a group of crows called? Bonus: how about ravens?","Murder of crows. An unkindness of ravens."
C,Crows,Hollywood Heckle and Jive,"Give me the name of a pair of cartoon crows, actually magpies, produced by Terrytoons that 1st appeared in 1946.","Heckle and Jeckle."
C,Crows,I Believe I can Fly,"Name me the disney movie with a group of 5 singing crows.","Dumbo."
C,Crowns,God Save the Queen,"What 3 actresses have played Queen Elizabeth on the Crown?","Claire Foy, Olivia Colman and Imelda Staunton."
C,Crowns,Dancing in the Moonlight,"Who were the first people to use crowns on teeth?","Romans in 500 BCE. Also the Etruscans."
C,Crowns,Sparkling Diamonds,"The United Kingdom's Crown Jewels. Where are they kept? Bonus: how many are there?","Tower of London, 142 objects and over 23,578 gemstones."
C,Crowns,For the Love of Money,"England used a coin called the crown from 1707–1965. How much was it worth in pounds?"," ¼ of a pound."
C,Clowns,Art is Dead,"Name me the scary clown from the Stephen King story It. Bonus: name me the even scarier clown from the movie Terrifier and Terrifier 2","Pennywise and Art."
C,Clowns,Tears of a Clown,"Name me an opera that  tells the tale of Canio, actor and leader of a commedia dell'arte theatrical company, who murders his wife Nedda and her lover Silvio on stage during a performance.","Pagliacci."
C,Clowns,Killer Queen,"Name me 1988 movie directed by the Chiodo brothers about a clan of evil extraterrestrials who invade a small town in order to capture, kill and harvest the human inhabitants to use as food.","Killer Klowns from Outer Space."
C,Clowns,Circus Music,"Name me a serial killer clown who killed at least 33 people. Bonus: give me his clown name.","John Wayne Gacy. Pogo the Clown or Patches the Clown."
C,C Sports,Croquet,"Name me a sport where you use mallets to smack balls around a yard and try to get them through hoops. Bonus: what are the hoops called?","Croquet, wickets."
C,C Sports,Eat It,"Takeru Kobayashi is a six time champion of what type of event?","Competitive eating. Nathan's Hot Dog Eating Contest."
C,C Sports,Capoeira,"Name me a form of martial art from Brazil which has a combination of aspects of dance moves, acrobatics, movements and music.","Capoeira."
C,C Sports,Save a Horse,"What is the sport called cutting?","An American western style sport of the equestrian discipline in which the objective for a rider on a horseback is to separate a few cows from its herd and prevent them from returning."
C,Cookies,C is for Cookie,"What is the cookie monster's name?","Sidney Monster."
C,Cookies,Don't Fence me In,"In 2018 animal crackers made a change to their box. What was this change?","They took away the cages the animals where in."
C,Cookies,Watermelon,"I’m going to list 4 oreo flavors, let me know what ones are real? Or all of them. Or none of them. Watermelon, Cherry Cola, Churro, Lady gaga.","All of them."
C,Cookies,Moves Like Jagger,"What's the difference between a Macaron and a macaroon?","Macarons are made with almond meal, and macaroons are made with shredded coconut."
C,Casinos,Ziggy Stardust,"The 1995 movie Casino is based on the life of casino owner Frank Rosenthal. What casino did he run?","Stardust, Fremont, Marina(MGM Grand), and Hacienda."
C,Casinos,I'm not OK,"What state has the most Casinos? Nevada with 334. What state has the 2nd most?","Oklahoma with 134."
C,Casinos,Hold on Loosely,"How many spaces are there on a standard roulette wheel which includes zero and double zero?","38. One through thirty-six plus the zeroes. Those little spaces are technically called pockets."
C,Casinos,What does the Fox Say,"What opened first, Mohegan Sun or Foxwoods?","Fox Woods, as a bingo hall in 1986 and as a full casino in 1992. Mohegan opened in 1996."
C,Canadians,Carry On,"Of the main characters in the Matrix movies are Canadian. Who are they?","Keanua Reeves and Carrie Ann Moss."
C,Canadians,Let's all go to the mall,"From the show How I met your mother, what is the name of the character Robin Scherbatsky's alter ego who was a singing sensation, kind of, in canada.","Robin Sparkles."
C,Canadians,Blinding Lights,"R&B star whose real name is Abel Tesfaye (tes -fai - ey)is from Canada. What is he better known as? Bonus: correct spelling.","The Weeknd."
C,Canadians,Born in East LA,"Give me the name of a comedian from the 70s. He and his comedy partner where big fans of herbal relaxants.","Tommy Chong."
C,Crabs,Horshoes and Hand Grenades,"Are Horseshoe crabs crabs?","No. They are not even crustaceans. Instead, they have their own separate class named Merostomata or Chelicerata. They have hardly changed since the age of the dinosaurs, and their closest-living relatives are spiders."
C,Crabs,Under the Sea,"Name me King Triton’s advisor from the Little Mermaid.","Sebastian."
C,Crabs,Shiny,"Name me the giant crab, and the actor who voiced him from Moana.","Tamatoa, Jemaine Clement."
C,Crabs,Fishing,"What three crabs do they fish for on the show Deadliest catch?","Opilio (snow crab), King Crab, and Bairdi Crab."
C,Cats,I will Survive,"Unsinkable Sam, this cat was the ship's mascot on the battleship Bismarck. When the ship was sunk he was found floating on some debris and rescued. He served in the British navy for several years. How many British ships was he on?","4. Destroyer HMS Cossack - torpedoed and sunk. Destroyer HMS Legion - Damaged when the cossack exploded. Aircraft Carrier HMS Ark Royal - Torpedoed and sunk. Destroyer HMS Lightning - Served until transferred to land."
C,Cats,Pokemon Theme,"From the show Pokemon, name me the cat like pokemon that hangs out with Team Rocket.","Meowth."
C,Cats,Cast of Sabrina the Teenage Witch,"Name me the talking  cat on Sabrina the Teenage Witch (the 1996-2003 sitcom). 3 point bonus if you can give me his last name too.","Salem Saberhagen."
C,Cats,Stray Cat Strut,"Cats walk in a very interesting fashion. They move both their right feet then both their left feet. Only 2 other animals naturally move this way. Name either one. 3 points for 1, 5 for both.","Camels and Giraffes."
C,Caves,Inner City Pressure,"I’m going to list 3 caves. Tell what country the are in, 2 points each. Carlsbad Caverns National Park, Waitomo Glowworm Caves, Reed Flute Cave.","New Mexico USA, New Zealand, China."
C,Caves,Spellbound,"What is the hobby of cave exploring or caving called?","Spelunking."
C,Caves,Pitch Black,"Name me a 2005 movie where a group of women go spelunking and encounter humanoid flesh eating predators. There could be a few that fit this description, but I want the good one. This has 86% on rotten tomatoes!","Descent."
C,Caves,Underground,"The TAG Corner is a name for the region where the U.S. states of Tennessee, Alabama, and Georgia come together. It's mountainous and has a lot of limestone. There are many caves. Experts estimate about how many caves?","14,000."
C,Cryptids,Devil Came to Me,"In what us state would you find the dover demon?","Dover Massachusetts."
C,Cryptids,I Believe I can Fly,"What of the following cryptids supposedly has wings? Jersey devil, Mokele-mbembe or the Yowie?","Jersey Devil. It's a kind of a bat winged upright Devil horse thing. Mokele-mbembe is a dinosaur like a brontosaurus from the Congo. Yowie is a large and hairy human-like entity, various other descriptions from Australia."
C,Cryptids,Long Island,"A mysterious corpse was found on a beach in Long Island, New York, in 2008. It resembled a hairless beast with a bizarre, toothy beak. Experts later identified it as a raccoon that had undergone decomposition and lost part of its jaw. What was it called?","Montauk Monster."
C,Cryptids,Snakeskin Boots,"Describe for me the South African monster the grootslang. It's a combination of 2 animals. 3 points for 1. 7 points for both.","Front end is elephant. Back end is snake."
C,Cycles,Ordinary World,"What is the term for the old time bike with a giant wheel and a little wheel?","A penny farthing a high wheeler or an ordinary also boneshaker."
C,Cycles,Theme from Chips,"Name me the 1978 motorcycle cop drama or the 2017 comedy starring Dax Shepard and Michael Pena. 2 point bonus: The title is an acronym. What does it stand for?","CHIPS, California Highway Patrol."
C,Cycles,Bicycle Race,"In what year was the Tour De France first run?","1903."
C,Cycles,Spiderweb / Spiderman Theme,"WHat is the name of the three wheeled Can Am Motorcycle with two wheels in front and one in back?","Spyder."
C,Cars,Major Tom,"What was the first car launched into space?","Tesla Roadster in February 2018, Elon Musk launched a Tesla Roadster into orbit. Yes, an actual car launched at a speed of 18,000 mph was sent cruising around Earth!"
C,Cars,You Might Think,"What do the letters in BMW stand for?","Bavarian Motor Works."
C,Cars,One Headlight,"In 1947, the American Tucker was built and it had the world's first padded dashboard. It also came with an interesting headlight set up. What was it?","A middle headlight that turned with the steering wheel."
C,Cars,Learn to Fly,"What was the Ford Mustang Originally named after?","The P51 Mustang fighter plane. Ford designer John Najjar was involved in the design of the Mustang prototype and was also a big fan of the P-51. It was symbolized by the horse later after it was released."
C,Countries,Borderline,"Which two countries share the longest border in the world?","United States of America and Canada. It is over 8893 km / 5525 miles long."
C,Countries,Final Countdown,"Which country in the European Union has the biggest population?","Germany has the biggest population in the EU. 82 million people live in this country in central Europe."
C,Countries,Island Song,"What country is made up of 6,000 islands, the largest being Honshu, Hokkaido, Kyushu and Shikoku?","Japan."
